<!ELEMENT theme_official_plugins (theme*) >
<!ELEMENT theme (plugin*)>
<!ATTLIST theme_official_plugins xmlns CDATA #REQUIRED >
<!ATTLIST theme name CDATA #REQUIRED >
<!ELEMENT plugin (name,label,path,description,official_link) >
<!ELEMENT name (#PCDATA) >
<!ELEMENT label (#PCDATA) >
<!ELEMENT path (#PCDATA) >
<!ELEMENT description (#PCDATA) >
<!ELEMENT official_link (#PCDATA) >